<?xml version="1.0" encoding="UTF-8"?>
<test-table xmlns="http://formal.iti.kit.edu/exteta-1.0"
            xmlns:xsi="http://www.w3.org/2001/XMLSchema-instance"
            xsi:schemaLocation="http://formal.iti.kit.edu/exteta-1.0 ../src/main/xsd/exteta-1.0.xsd "
            name="Ta"
            version="1.0">

    <variables>
        <variable data-type="INT" io="input" name="i"/>
        <variable data-type="INT" io="output" name="o"/>
        <variable data-type="INT" io="output" name="c"/>
    </variables>

    <steps>
        <step duration="[10,-]">
            <cell>-</cell>
            <cell>i</cell>
            <cell>42</cell>
        </step>
    </steps>

</test-table>
